{
 "schema_version": "1.0",
 "goal": {
  "id": "python",
  "name": "Python",
  "category": "Programming Languages",
  "group": "Languages",
  "type": "language",
  "version": "2026.5",
  "valid_for": "Python 3.12+",
  "last_updated": "2026-10-06",
  "official_url": "https://docs.python.org/3/",
  "languages": [
   "en",
   "hi"
  ],
  "video_language_note": "Every topic has an English video; Hindi videos are available for Phases 1–3. Phases 4–5 are English-only (tagged).",
  "career_outcomes": [
   "Write scripts and automate tasks",
   "Build CLI apps, scrapers and simple APIs",
   "Analyse data with Pandas and plot charts",
   "Use Git/GitHub and write tests",
   "Next roadmaps: Backend, Data Science, AI/ML"
  ],
  "resource_policy": "Links only to free, legal sources (official bodies, open-licence textbooks, reputable free platforms, public YouTube videos). No copyrighted PDFs re-hosted. YouTube videos are never paywalled or ad-gated.",
  "estimated_hours": {
   "content": 112,
   "mocks_and_milestones": 2,
   "spaced_revision_allowance": 12,
   "total": 126,
   "note": "Video minutes are real YouTube durations with the +15% rule applied (see goal.last_link_check). Mocks and the revision allowance remain planning figures."
  },
  "last_link_check": "2026-10-17"
 },
 "scheduler_hints": {
  "video_time_multiplier": 1.15,
  "round_up_to_minutes": 5,
  "warmup_recall_minutes": 10,
  "focus_block_minutes": 25,
  "break_minutes": 5,
  "spaced_review_offsets_days": [
   1,
   3,
   7,
   21,
   45
  ],
  "confidence_to_next_review_days": {
   "need_revision": 1,
   "little_afraid": 2,
   "confident": 4,
   "all_cleared": 7,
   "mastered": 21
  },
  "weekly_pattern": {
   "new_content_days": 5,
   "mixed_practice_and_weekly_test_days": 1,
   "light_revision_or_rest_days": 1
  },
  "rest_day_limits": {
   "per_week": 1,
   "per_month": 4
  },
  "interleave_by": "subject",
  "reserve_final_fraction_for_mocks_and_revision": 0.15,
  "mastery_gate": {
   "weekly_test_min_score_pct": 60,
   "remediation_block_minutes": 45
  },
  "missed_day_policy": "shift_forward",
  "recalculate_from": "next_incomplete_task"
 },
 "phases": [
  {
   "id": "python-p1",
   "order": 1,
   "name": "Python Fundamentals",
   "topic_ids": [
    "py-setup",
    "py-variables",
    "py-io-operators",
    "py-strings",
    "py-conditionals",
    "py-loops",
    "py-functions",
    "py-lists",
    "py-tuples-sets",
    "py-dicts",
    "proj-calculator"
   ]
  },
  {
   "id": "python-p2",
   "order": 2,
   "name": "Intermediate Python",
   "topic_ids": [
    "py-comprehensions",
    "py-scope-lambda",
    "py-modules-pip",
    "py-files",
    "py-exceptions",
    "py-recursion",
    "proj-todo"
   ]
  },
  {
   "id": "python-p3",
   "order": 3,
   "name": "Object-Oriented Programming",
   "topic_ids": [
    "py-classes",
    "py-inheritance",
    "py-dunder",
    "py-iterators-generators",
    "py-decorators"
   ]
  },
  {
   "id": "python-p4",
   "order": 4,
   "name": "Libraries & Real-world Python",
   "topic_ids": [
    "py-venv",
    "py-stdlib",
    "py-requests-apis",
    "proj-scraper",
    "py-numpy",
    "py-pandas",
    "py-matplotlib",
    "proj-api"
   ]
  },
  {
   "id": "python-p5",
   "order": 5,
   "name": "Professional Skills & Final Project",
   "topic_ids": [
    "py-git",
    "py-testing",
    "proj-final"
   ]
  }
 ],
 "topics": [
  {
   "id": "py-setup",
   "subject": "Python",
   "title": "Setup: Install Python & VS Code, run your first program",
   "phase": 1,
   "order": 1,
   "kind": "learn",
   "weightage": "core",
   "est_minutes_total": 105,
   "blocks": [
    {
     "id": "py-setup-learn",
     "type": "learn",
     "title": "Watch: Setup: Install Python & VS Code, run your first program",
     "est_minutes": 20,
     "resources": [
      {
       "type": "video",
       "role": "main",
       "title": "Python Tutorial for Beginners 1: Install and Setup for Mac and Windows",
       "url": "https://www.youtube.com/watch?v=YYXdXT2l-Gg",
       "youtube_id": "YYXdXT2l-Gg",
       "lang": "en",
       "provider": "YouTube",
       "duration_seconds": 929,
       "est_minutes": 20,
       "duration_source": "youtube_api",
       "access": "all",
       "ad_gate_allowed": true,
       "status": "active",
       "last_checked": "2026-10-17",
       "channel": "Corey Schafer"
      },
      {
       "type": "video",
       "role": "main_hi",
       "title": "Introduction to Programming & Python | Python Tutorial - Day #1",
       "url": "https://www.youtube.com/watch?v=7wnove7K-ZQ",
       "youtube_id": "7wnove7K-ZQ",
       "lang": "hi",
       "provider": "YouTube",
       "duration_seconds": 710,
       "est_minutes": 15,
       "duration_source": "youtube_api",
       "access": "all",
       "ad_gate_allowed": true,
       "status": "active",
       "last_checked": "2026-10-17",
       "channel": "CodeWithHarry"
      }
     ]
    },
    {
     "id": "py-setup-read",
     "type": "read",
     "title": "Read the notes and type out every example yourself",
     "est_minutes": 30,
     "resources": [
      {
       "type": "notes",
       "title": "interpreter.html",
       "url": "https://docs.python.org/3/tutorial/interpreter.html",
       "lang": "en",
       "provider": "docs.python.org",
       "access": "all",
       "status": "active",
       "last_checked": "2026-10-17",
       "role": "main",
       "ad_gate_allowed": true
      },
      {
       "type": "notes",
       "title": "python_getstarted.asp",
       "url": "https://www.w3schools.com/python/python_getstarted.asp",
       "lang": "en",
       "provider": "www.w3schools.com",
       "access": "all",
       "status": "active",
       "last_checked": "2026-10-17",
       "role": "main",
       "ad_gate_allowed": true
      },
      {
       "type": "notes",
       "title": "Think Python 3e – chap01.html",
       "url": "https://allendowney.github.io/ThinkPython/chap01.html",
       "lang": "en",
       "provider": "Think Python 3e (CC BY-NC)",
       "access": "premium",
       "status": "active",
       "last_checked": "2026-10-17",
       "role": "extra"
      }
     ]
    },
    {
     "id": "py-setup-practice",
     "type": "practice",
     "title": "Practice exercises (free account may be needed)",
     "est_minutes": 45,
     "resources": [
      {
       "type": "practice",
       "title": "Hello World",
       "url": "https://exercism.org/tracks/python/exercises/hello-world",
       "lang": "en",
       "provider": "exercism.org",
       "access": "all",
       "status": "active",
       "last_checked": "2026-10-17",
       "ad_gate_allowed": true
      }
     ]
    },
    {
     "id": "py-setup-recall",
     "type": "recall",
     "title": "Recall check",
     "est_minutes": 10,
     "resources": []
    }
   ],
   "recall": [
    {
     "q": "Command to check the installed Python version?",
     "a": "python --version (or python3 --version)"
    },
    {
     "q": "What does print() do?",
     "a": "Writes text/values to the console"
    },
    {
     "q": "File extension for Python scripts?",
     "a": ".py"
    }
   ]
  },
  {
   "id": "py-variables",
   "subject": "Python",
   "title": "Variables, Data Types & Numbers",
   "phase": 1,
   "order": 2,
   "kind": "learn",
   "weightage": "core",
   "est_minutes_total": 395,
   "blocks": [
    {
     "id": "py-variables-learn",
     "type": "learn",
     "title": "Watch: Variables, Data Types & Numbers",
     "est_minutes": 310,
     "resources": [
      {
       "type": "video",
       "role": "main",
       "title": "Learn Python - Full Course for Beginners [Tutorial]",
       "url": "https://www.youtube.com/watch?v=rfscVS0vtbw",
       "youtube_id": "rfscVS0vtbw",
       "lang": "en",
       "provider": "YouTube",
       "duration_seconds": 16012,
       "est_minutes": 310,
       "duration_source": "youtube_api",
       "access": "all",
       "ad_gate_allowed": true,
       "status": "active",
       "last_checked": "2026-10-17",
       "channel": "freeCodeCamp.org"
      },
      {
       "type": "video",
       "role": "main_hi",
       "title": "Data Types in Python | 100 Days of Python Programming",
       "url": "https://www.youtube.com/watch?v=NQ0JI5IKggI",
       "youtube_id": "NQ0JI5IKggI",
       "lang": "hi",
       "provider": "YouTube",
       "duration_seconds": 479,
       "est_minutes": 10,
       "duration_source": "youtube_api",
       "access": "all",
       "ad_gate_allowed": true,
       "status": "active",
       "last_checked": "2026-10-17",
       "channel": "CampusX"
      }
     ]
    },
    {
     "id": "py-variables-read",
     "type": "read",
     "title": "Read the notes and type out every example yourself",
     "est_minutes": 30,
     "resources": [
      {
       "type": "notes",
       "title": "python_variables.asp",
       "url": "https://www.w3schools.com/python/python_variables.asp",
       "lang": "en",
       "provider": "www.w3schools.com",
       "access": "all",
       "status": "active",
       "last_checked": "2026-10-17",
       "role": "main",
       "ad_gate_allowed": true
      },
      {
       "type": "notes",
       "title": "python_datatypes.asp",
       "url": "https://www.w3schools.com/python/python_datatypes.asp",
       "lang": "en",
       "provider": "www.w3schools.com",
       "access": "all",
       "status": "active",
       "last_checked": "2026-10-17",
       "role": "main",
       "ad_gate_allowed": true
      },
      {
       "type": "notes",
       "title": "python_numbers.asp",
       "url": "https://www.w3schools.com/python/python_numbers.asp",
       "lang": "en",
       "provider": "www.w3schools.com",
       "access": "all",
       "status": "active",
       "last_checked": "2026-10-17",
       "role": "main",
       "ad_gate_allowed": true
      },
      {
       "type": "notes",
       "title": "introduction.html",
       "url": "https://docs.python.org/3/tutorial/introduction.html",
       "lang": "en",